{
  "$schema": "https://json-schema.org/draft/2020-12/schema",
  "$id": "gokv.knowledge_item.v1",
  "title": "GOKV Knowledge Item",
  "type": "object",
  "additionalProperties": false,
  "required": [
    "knowledge_id", "schema_version", "knowledge_version", "kind", "title",
    "summary", "status", "scope", "applicability", "preconditions",
    "procedure", "decision_rules", "stop_conditions", "validation",
    "failure_modes", "recovery", "evidence_refs", "source_commits",
    "source_checkpoints", "metrics_refs", "confidence", "privacy_class",
    "tags", "created_at", "updated_at", "supersedes", "superseded_by"
  ],
  "properties": {
    "knowledge_id": {"type": "string", "pattern": "^[a-z0-9]+(?:_[a-z0-9]+)*$"},
    "schema_version": {"const": "gokv.knowledge_item.v1"},
    "knowledge_version": {"type": "string", "pattern": "^(0|[1-9]\\d*)\\.(0|[1-9]\\d*)\\.(0|[1-9]\\d*)$"},
    "kind": {"type": "string"},
    "title": {"type": "string", "minLength": 1},
    "summary": {"type": "string", "minLength": 1},
    "status": {"enum": ["OBSERVED", "CANDIDATE", "VALIDATED", "PROMOTED", "REVISED", "DEPRECATED", "REPLACED"]},
    "scope": {"enum": ["GLOBAL", "IA_CORE_BUILD", "DOMAIN", "BUSINESS", "TEAM", "AGENT", "TASK"]},
    "applicability": {"type": "object"},
    "preconditions": {"type": "array", "items": {"type": "string"}},
    "procedure": {"type": "array", "items": {"type": "string"}},
    "decision_rules": {"type": "array", "items": {"type": "string"}},
    "stop_conditions": {"type": "array", "items": {"type": "string"}},
    "validation": {"type": "array", "items": {"type": "string"}},
    "failure_modes": {"type": "array", "items": {"type": "string"}},
    "recovery": {"type": "array", "items": {"type": "string"}},
    "evidence_refs": {"type": "array", "items": {"type": "object"}},
    "source_commits": {"type": "array", "items": {"type": "string"}},
    "source_checkpoints": {"type": "array", "items": {"type": "string"}},
    "metrics_refs": {"type": "array", "items": {"type": "string"}},
    "confidence": {"type": "object"},
    "privacy_class": {"type": "string"},
    "tags": {"type": "array", "items": {"type": "string"}},
    "created_at": {"type": "string", "format": "date-time"},
    "updated_at": {"type": "string", "format": "date-time"},
    "supersedes": {"type": "array", "items": {"type": "string"}},
    "superseded_by": {"type": "array", "items": {"type": "string"}},
    "learning_origin": {"enum": ["DEVELOPMENT_ORIGIN", "FIELD_OPERATION", "MIXED_ORIGIN", "EXTERNAL_REFERENCE", "UNKNOWN"]},
    "lineage": {
      "type": "array",
      "items": {
        "type": "object",
        "additionalProperties": false,
        "required": ["relation", "related_knowledge_id", "related_origin", "evidence_refs", "notes"],
        "properties": {
          "relation": {"enum": ["CONFIRM", "REFINE", "LIMIT", "CONTRADICT", "SUPERSEDE"]},
          "related_knowledge_id": {"type": "string"},
          "related_origin": {"enum": ["DEVELOPMENT_ORIGIN", "FIELD_OPERATION", "MIXED_ORIGIN", "EXTERNAL_REFERENCE", "UNKNOWN"]},
          "evidence_refs": {"type": "array", "items": {"type": "string"}},
          "notes": {"type": "array", "items": {"type": "string"}}
        }
      }
    }
  }
}
