{"schema_version":"gokv.knowledge_item.v1","applicability":{"mission_types":["planning","decision_review","architecture"],"scopes":["IA_CORE_BUILD","GLOBAL"]},"confidence":{"level":"MEDIUM","rationale":"1.199 redujo 395 posibles preguntas a 8 paquetes, pero aÃºn requiere validar el costo de intervenciÃ³n en mÃ¡s bloques."},"decision_rules":[],"evidence_refs":[{"evidence_id":"human_decision_compression","kind":"document","ref":"docs/UI_UX_PANEL_MAESTRO_MICROCOPY_DIRECTOR_DECISION_SHEET_1_199.md","claim":"La compresiÃ³n evita pedir decisiones fila por fila."}],"failure_modes":["Eliminar intervenciÃ³n humana donde la semÃ¡ntica es genuinamente ambigua."],"knowledge_id":"human_intervention_is_high_value_resource","knowledge_version":"0.1.0","kind":"OPERATOR_INTERVENTION_PATTERN","metrics_refs":[],"preconditions":["Separar Level A/B de Level C/D."],"privacy_class":"ia_core_internal","procedure":["Derivar todo lo objetivo y elevar solo paquetes irreducibles."],"recovery":["Devolver una decisiÃ³n al operador cuando las interpretaciones sean igualmente vÃ¡lidas."],"scope":"IA_CORE_BUILD","source_checkpoints":["UI_UX_1_199"],"source_commits":["2ad648a","609d19f"],"status":"CANDIDATE","stop_conditions":["No optimizar el nÃºmero de preguntas a costa de contrato o contexto."],"summary":"La intervenciÃ³n humana debe reservarse para decisiones conceptuales que la evidencia no resuelve.","superseded_by":[],"supersedes":[],"tags":["operator","compression"],"title":"Human intervention is a high-value resource","updated_at":"2026-09-08T00:00:00+00:00","validation":[],"created_at":"2026-09-08T00:00:00+00:00"}
