{
  "schema_version": "gokv.knowledge_item.v1",
  "applicability": {"mission_types": ["all_development"], "scopes": ["IA_CORE_BUILD", "GLOBAL"]},
  "confidence": {"level": "LOW", "rationale": "Observed once in Macro-Mission 01; no external authorization evidence was available."},
  "created_at": "2026-09-11T00:00:00+00:00",
  "decision_rules": ["Classify HTTP read-only methods separately from identity, permission, ownership, and exposure authorization."],
  "evidence_refs": [
    {"evidence_id": "macro_01_route_reconnaissance", "kind": "document", "ref": "docs/ROADMAP_3_X_MACRO_01_ROUTE_RECONNAISSANCE.md", "claim": "Read-only HTTP methods did not imply safe exposure."},
    {"evidence_id": "macro_01_b3_coverage", "kind": "document", "ref": "docs/ROADMAP_3_X_MACRO_01_B3_COVERAGE.md", "claim": "Canonical contracts existed without proven legacy route coverage."}
  ],
  "failure_modes": ["Calling a GET route authorized merely because it does not mutate product state."],
  "knowledge_id": "read_only_method_is_not_read_authz",
  "knowledge_version": "0.1.0",
  "kind": "ARCHITECTURAL_LEARNING",
  "learning_origin": "DEVELOPMENT_ORIGIN",
  "lineage": [],
  "metrics_refs": ["roadmap_3_x_macro_01_learning_adjudication_metric"],
  "preconditions": ["A route method is known but identity, owner, exposure, and permission evidence may be incomplete."],
  "privacy_class": "ia_core_internal",
  "procedure": ["Inspect identity and trust boundary.", "Inspect owner and data sensitivity.", "Inspect canonical permission and confirmation evidence.", "Keep authorization unresolved when the chain is not demonstrated."],
  "recovery": ["Retain the route as unknown or not demonstrated and name the next evidence producer."],
  "scope": "IA_CORE_BUILD",
  "source_checkpoints": ["ROADMAP_3_X_MACRO_01"],
  "source_commits": ["be5986e0f8fd49a61694d2d8752bae20f0f52c52", "678910e119304cdc9cbbcd71ca0e72560c0f538d", "5fb046934ab764020b23dcf9a883b0e3a6896502", "fbbc5372865467c4c5de3c09e580644971e2d163"],
  "status": "CANDIDATE",
  "stop_conditions": ["Do not infer read authorization from method naming or absence of a write call."],
  "summary": "Read-only transport semantics do not establish read authorization or safe exposure.",
  "superseded_by": [],
  "supersedes": [],
  "tags": ["authorization", "read_only", "route_boundary"],
  "title": "Read-only method is not read authorization",
  "updated_at": "2026-09-11T00:00:00+00:00",
  "validation": ["Macro 01 route reconnaissance and canonical coverage guards."]
}
