{"schema_version":"gokv.knowledge_item.v1","applicability":{"mission_types":["architecture","development_foundation"],"scopes":["IA_CORE_BUILD"]},"confidence":{"level":"MEDIUM","rationale":"Los manifiestos de escala separan estaciones deterministas de fronteras semÃ¡nticas, pero la relaciÃ³n aÃºn es una heurÃ­stica."},"decision_rules":[],"evidence_refs":[{"evidence_id":"scale_distance_1197","kind":"document","ref":"docs/UI_UX_PANEL_MAESTRO_NEXT_POST_1_196_ASSEMBLED_BLOCK_MANIFEST_1_197.md","claim":"La escala se calcula por estaciones y frontera real."}],"failure_modes":["Forzar un tamaÃ±o fijo de bloque."],"knowledge_id":"deterministic_distance_defines_block_size","knowledge_version":"0.1.0","kind":"TASK_DECOMPOSITION_PATTERN","metrics_refs":[],"preconditions":["Mapear dependencias y fronteras."],"privacy_class":"ia_core_internal","procedure":["Separar estaciones por distancia determinista antes de fijar el tamaÃ±o."],"recovery":["Reducir el bloque al Ãºltimo gate demostrable."],"scope":"IA_CORE_BUILD","source_checkpoints":["UI_UX_1_195","UI_UX_1_197"],"source_commits":["8b4ce90","6b9c806"],"status":"CANDIDATE","stop_conditions":["No usar el conteo de estaciones como objetivo de calidad."],"summary":"El tamaÃ±o de un bloque debe seguir la distancia determinista hasta su frontera real.","superseded_by":[],"supersedes":[],"tags":["planning","block_size"],"title":"Deterministic distance defines block size","updated_at":"2026-09-08T00:00:00+00:00","validation":[],"created_at":"2026-09-08T00:00:00+00:00"}
