{
  "schema_version": "gokv.knowledge_item.v1",
  "knowledge_id": "contract_precision_multiplies_verified_scope",
  "knowledge_version": "0.1.0",
  "kind": "ARCHITECTURAL_LEARNING",
  "title": "Contract precision multiplies verified scope",
  "summary": "Greater contract precision can increase the governable scope and the verified responsibility per usage without expanding product authority.",
  "status": "CANDIDATE",
  "scope": "IA_CORE_BUILD",
  "applicability": {"mission_types": ["roadmap", "architecture", "all_development"], "scopes": ["IA_CORE_BUILD", "GLOBAL"]},
  "preconditions": ["A current contract, evidence boundary, owner and stop condition are explicit."],
  "procedure": ["Separate deterministic evidence from authority decisions.", "Measure the surface that is actually verified.", "Keep external and human boundaries explicit.", "Expand only the scope whose dependencies and rollback are governed."],
  "decision_rules": ["Do not convert precision into permission.", "Do not treat a larger documented scope as production readiness."],
  "stop_conditions": ["Stop when the next step requires authority, external evidence, runtime, provider access or product semantics."],
  "validation": ["Macro 03 phase graph, F-004 family record and B-7 closure matrix are internally consistent."],
  "failure_modes": ["Equating more documentation with more operational capability.", "Using a broad mission to bypass a named frontier."],
  "recovery": ["Return to the last green station and narrow the next block to the first unresolved authority boundary."],
  "evidence_refs": [
    {"evidence_id": "macro_03_graph", "kind": "document", "ref": "docs/ROADMAP_3_X_FULL_PHASE_EXECUTION_GRAPH.md", "claim": "The graph distinguishes governed documentary scope from unresolved authority."},
    {"evidence_id": "macro_03_b7", "kind": "document", "ref": "docs/ROADMAP_3_X_MACRO_03_B7_CLOSURE_READINESS_MATRIX.md", "claim": "B-7 can be ready for acceptance without claiming production readiness."}
  ],
  "source_commits": ["83918905ff4f0e88416ef12c7d2c9e9b5057b192", "53f0c0cb93ce7fc23e51dae5705d4c9762f9daaf", "49952068b0ec8e6d03f0de77c213731632c41455"],
  "source_checkpoints": ["ROADMAP_3_X_MACRO_02_2", "ROADMAP_3_X_MACRO_03"],
  "metrics_refs": ["roadmap_3_x_macro_03_execution_metric"],
  "confidence": {"level": "LOW", "rationale": "Development-origin observation from one Macro 03 graph and closure exercise; field confirmation is absent."},
  "privacy_class": "ia_core_internal",
  "tags": ["contracts", "scope", "evidence", "governance"],
  "created_at": "2026-09-12T00:00:00+00:00",
  "updated_at": "2026-09-12T00:00:00+00:00",
  "supersedes": [],
  "superseded_by": [],
  "learning_origin": "DEVELOPMENT_ORIGIN",
  "lineage": []
}
