{"schema_version":"gokv.knowledge_item.v1","applicability":{"mission_types":["all_development"],"scopes":["IA_CORE_BUILD","GLOBAL"]},"confidence":{"level":"HIGH","rationale":"1.199 publicÃ³ cada estaciÃ³n en commits separados y pudo reconstruir la continuidad por hash."},"decision_rules":["El prefijo del commit debe reflejar el diff real."],"evidence_refs":[{"evidence_id":"station_commits_1199","kind":"commit","ref":"git:48598d4..7cb7134","claim":"N1-N7 tienen commits localizados y trazables."}],"failure_modes":["Ocultar varias estaciones en un commit globo."],"knowledge_id":"station_local_commits","knowledge_version":"0.1.0","kind":"COMMIT_STRATEGY","metrics_refs":[],"preconditions":["Una estaciÃ³n debe tener diff real."],"privacy_class":"ia_core_internal","procedure":["Cerrar y validar una estaciÃ³n, crear un commit semÃ¡ntico y registrar su hash."],"recovery":["Revertir el commit localizado sin tocar estaciones previas."],"scope":"IA_CORE_BUILD","source_checkpoints":["UI_UX_1_199"],"source_commits":["48598d4","b407756","2ad648a","9248aae","609d19f","6b6b8d0"],"status":"VALIDATED","stop_conditions":["No crear commit vacÃ­o ni mezclar estaciones sin justificaciÃ³n."],"summary":"Los commits locales por estaciÃ³n reducen ambigÃ¼edad y hacen reversible el progreso.","superseded_by":[],"supersedes":[],"tags":["git","commits","traceability"],"title":"Station-local commits","updated_at":"2026-09-08T00:00:00+00:00","validation":["Log, diff real y suite de continuidad."],"created_at":"2026-09-08T00:00:00+00:00"}
