{"schema_version":"gokv.knowledge_item.v1","applicability":{"mission_types":["ui_ux","architecture","development_foundation"],"scopes":["IA_CORE_BUILD"]},"confidence":{"level":"HIGH","rationale":"El bloque ensamblado 1.194 fue ejecutado por estaciones con gates, pruebas y preservaciÃ³n contractual."},"decision_rules":["Separar estaciones por dependencia y riesgo."],"evidence_refs":[{"evidence_id":"assembled_block_1194","kind":"checkpoint","ref":"docs/UI_UX_PANEL_MAESTRO_RESPONSIVE_VISUAL_COHERENCE_ASSEMBLED_BLOCK_1_194.md","claim":"Seis estaciones independientes cerraron un bloque ensamblado sin mezclar fronteras semÃ¡nticas."}],"failure_modes":["Mezclar piezas con dependencias distintas."],"knowledge_id":"controlled_assembled_block_execution","knowledge_version":"0.1.0","kind":"PATTERN","metrics_refs":[],"preconditions":["Existencia de baseline y contratos protegidos."],"privacy_class":"ia_core_internal","procedure":["Definir estaciones, ejecutar focal, cerrar gate y continuar solo con evidencia."],"recovery":["Revertir Ãºnicamente la estaciÃ³n fallida y conservar las anteriores."],"scope":"IA_CORE_BUILD","source_checkpoints":["UI_UX_1_194"],"source_commits":["7196ad5","d7321d2"],"status":"VALIDATED","stop_conditions":["Detenerse ante cambio de contrato o superficie protegida."],"summary":"Un bloque grande puede ejecutarse con estaciones controladas, gates locales y rollback por estaciÃ³n.","superseded_by":[],"supersedes":[],"tags":["execution","stations","gates"],"title":"Controlled assembled block execution","updated_at":"2026-09-08T00:00:00+00:00","validation":["Focal, group, canonical y browser checks."],"created_at":"2026-09-08T00:00:00+00:00"}
