{"schema_version":"gokv.knowledge_item.v1","applicability":{"mission_types":["planning","architecture","development_foundation"],"scopes":["IA_CORE_BUILD"]},"confidence":{"level":"MEDIUM","rationale":"La compresiÃ³n de 395 ocurrencias hasta paquetes demuestra que algunas aparentes decisiones se derivan, pero no todas."},"decision_rules":[],"evidence_refs":[{"evidence_id":"apparent_frontier_1199","kind":"document","ref":"docs/UI_UX_PANEL_MAESTRO_MICROCOPY_DIRECTION_COMPRESSION_1_199.md","claim":"Contrato, consistencia y geometrÃ­a redujeron decisiones humanas sin falsificar la frontera."}],"failure_modes":["Reducir toda frontera por conveniencia numÃ©rica."],"knowledge_id":"apparent_frontier_can_be_designed_away","knowledge_version":"0.1.0","kind":"TASK_DECOMPOSITION_PATTERN","metrics_refs":[],"preconditions":["Analizar evidencia antes de preguntar al operador."],"privacy_class":"ia_core_internal","procedure":["Derivar contrato, precedentes y reglas antes de clasificar como decisiÃ³n humana."],"recovery":["Devolver al paquete humano toda ambigÃ¼edad restante."],"scope":"IA_CORE_BUILD","source_checkpoints":["UI_UX_1_199"],"source_commits":["2ad648a"],"status":"CANDIDATE","stop_conditions":["No comprimir decisiones conceptualmente distintas."],"summary":"Una frontera aparente puede reducirse con anÃ¡lisis, pero solo hasta donde la evidencia permite.","superseded_by":[],"supersedes":[],"tags":["planning","compression"],"title":"Apparent frontier can be designed away","updated_at":"2026-09-08T00:00:00+00:00","validation":[],"created_at":"2026-09-08T00:00:00+00:00"}
