{"schema_version":"gokv.knowledge_item.v1","applicability":{"mission_types":["all_development"],"scopes":["IA_CORE_BUILD","GLOBAL"]},"confidence":{"level":"MEDIUM","rationale":"La continuidad de commits, readiness y reportes permitiÃ³ retomar 1.199 sin rehacer estaciones, aunque no hay experimento contrafactual."},"decision_rules":[],"evidence_refs":[{"evidence_id":"continuity_rework_1199","kind":"checkpoint","ref":"docs/UI_UX_PANEL_MAESTRO_MICROCOPY_DIRECTION_REVIEW_CHECKPOINT_1_199.md","claim":"El estado final conserva readiness, commits y gates trazables."}],"failure_modes":["Confiar en narrativa sin hashes, tests o diffs."],"knowledge_id":"context_continuity_reduces_rework","knowledge_version":"0.1.0","kind":"CONTEXT_MANAGEMENT_PATTERN","metrics_refs":[],"preconditions":["Checkpoints y artefactos versionados."],"privacy_class":"ia_core_internal","procedure":["Registrar estado, siguiente prompt, gates, commits y lÃ­mites al cierre de cada bloque."],"recovery":["Reconstruir desde Git y fuentes estructuradas, no desde memoria conversacional."],"scope":"IA_CORE_BUILD","source_checkpoints":["UI_UX_1_197","UI_UX_1_199"],"source_commits":["6b9c806","7cb7134"],"status":"CANDIDATE","stop_conditions":["No tratar el resumen como fuente Ãºnica si existe artefacto estructurado."],"summary":"La continuidad versionada parece reducir retrabajo y debe medirse en bloques futuros.","superseded_by":[],"supersedes":[],"tags":["context","continuity"],"title":"Context continuity reduces rework","updated_at":"2026-09-08T00:00:00+00:00","validation":[],"created_at":"2026-09-08T00:00:00+00:00"}
