{"schema_version":"gokv.knowledge_item.v1","applicability":{"mission_types":["decision_review","planning","ui_ux"],"scopes":["IA_CORE_BUILD","GLOBAL"]},"confidence":{"level":"HIGH","rationale":"1.199 convirtiÃ³ 395 registros Direction Required en 8 paquetes conceptuales para DirecciÃ³n."},"decision_rules":["Una decisiÃ³n de paquete debe tener consecuencias y lÃ­mites explÃ­citos."],"evidence_refs":[{"evidence_id":"decision_packages_1199","kind":"document","ref":"docs/UI_UX_PANEL_MAESTRO_MICROCOPY_DIRECTOR_DECISION_SHEET_1_199.md","claim":"El Sheet contiene 8 decisiones reales y separa Level D."}],"failure_modes":["Pedir decisiÃ³n por ocurrencia o mezclar permisos con estilo."],"knowledge_id":"compile_human_decisions_into_packages","knowledge_version":"0.1.0","kind":"TASK_DECOMPOSITION_PATTERN","metrics_refs":[],"preconditions":["Unidades de decisiÃ³n y determinismo separados."],"privacy_class":"ia_core_internal","procedure":["Agrupar por elecciÃ³n conceptual, registrar opciones y compilar allowlist despuÃ©s de respuesta."],"recovery":["Separar nuevamente un paquete si las opciones no aplican a todos sus miembros."],"scope":"IA_CORE_BUILD","source_checkpoints":["UI_UX_1_199"],"source_commits":["609d19f","5a004f4"],"status":"VALIDATED","stop_conditions":["No presentar cambio contractual como microcopy editorial."],"summary":"Las decisiones humanas se vuelven ejecutables despuÃ©s de compilar paquetes coherentes.","superseded_by":[],"supersedes":[],"tags":["decisions","packages"],"title":"Compile human decisions into packages","updated_at":"2026-09-08T00:00:00+00:00","validation":["8 paquetes, 1424 ocurrencias gobernadas y Level D separado."],"created_at":"2026-09-08T00:00:00+00:00"}
