{
  "schema_version": "gokv.knowledge_item.v1",
  "applicability": {"mission_types": ["all_development"], "scopes": ["IA_CORE_BUILD", "GLOBAL"]},
  "confidence": {"level": "LOW", "rationale": "Observed once in Macro-Mission 01; no production route evidence was used."},
  "created_at": "2026-09-11T00:00:00+00:00",
  "decision_rules": ["Treat callable provider or service chains as source capability only until permission and activation authority are proven."],
  "evidence_refs": [
    {"evidence_id": "macro_01_route_reconnaissance", "kind": "document", "ref": "docs/ROADMAP_3_X_MACRO_01_ROUTE_RECONNAISSANCE.md", "claim": "A callable chain did not prove permission or activation authority."},
    {"evidence_id": "macro_01_provider_boundary", "kind": "document", "ref": "docs/ROADMAP_3_0_PROVIDER_NETWORK_CREDENTIAL_GRAPH.md", "claim": "Provider source presence is distinct from runtime readiness."}
  ],
  "failure_modes": ["Conflating a callable function or provider path with an authorized route."],
  "knowledge_id": "callable_chain_is_not_authorized_route",
  "knowledge_version": "0.1.0",
  "kind": "ARCHITECTURAL_LEARNING",
  "learning_origin": "DEVELOPMENT_ORIGIN",
  "lineage": [],
  "metrics_refs": ["roadmap_3_x_macro_01_learning_adjudication_metric"],
  "preconditions": ["The source graph includes callable symbols, permission contracts, and activation gates."],
  "privacy_class": "ia_core_internal",
  "procedure": ["Record source reachability separately.", "Locate permission and confirmation contracts.", "Locate activation and readiness boundaries.", "Keep route authorization unresolved without a proven chain."],
  "recovery": ["Mark the surface as source-capable or unknown and request boundary evidence."],
  "scope": "IA_CORE_BUILD",
  "source_checkpoints": ["ROADMAP_3_X_MACRO_01"],
  "source_commits": ["be5986e0f8fd49a61694d2d8752bae20f0f52c52", "678910e119304cdc9cbbcd71ca0e72560c0f538d", "5fb046934ab764020b23dcf9a883b0e3a6896502", "fbbc5372865467c4c5de3c09e580644971e2d163"],
  "status": "CANDIDATE",
  "stop_conditions": ["No runtime or provider invocation is allowed during documentary classification."],
  "summary": "Callable chains are not evidence of route permission or activation authority.",
  "superseded_by": [],
  "supersedes": [],
  "tags": ["authorization", "provider_boundary", "runtime_boundary"],
  "title": "Callable chain is not authorized route",
  "updated_at": "2026-09-11T00:00:00+00:00",
  "validation": ["Macro 01 route reconnaissance and provider boundary documentation."]
}
