{
  "schema_version": "gokv.knowledge_item.v1",
  "applicability": {"mission_types": ["all_development", "test_hardening"], "scopes": ["IA_CORE_BUILD", "GLOBAL"]},
  "confidence": {"level": "LOW", "rationale": "Observed in Macro-Mission 02.1: root test collection imported a legacy NVIDIA probe and a legacy supervisor probe before any test body ran."},
  "created_at": "2026-09-11T00:00:00+00:00",
  "decision_rules": ["Collection and import must be side-effect free before any fixture or test body is available."],
  "evidence_refs": [
    {"evidence_id": "macro_02_1_hermetic_validation", "kind": "document", "ref": "docs/ROADMAP_3_X_MACRO_02_1_HERMETIC_VALIDATION_AND_COMMIT_ACCOUNTABILITY.md", "claim": "The default collection boundary is enforced before dangerous test modules are imported."},
    {"evidence_id": "macro_02_1_hermetic_guard", "kind": "test", "ref": "tests/test_roadmap_3_x_macro_02_1_hermetic_validation.py", "claim": "External probes collect safely, remain opt-in, and accidental egress is blocked."}
  ],
  "failure_modes": ["A top-level test statement instantiates a provider, reads a credential, starts a runtime, or calls network during collection."],
  "knowledge_id": "test_collection_must_be_side_effect_free",
  "knowledge_version": "0.1.0",
  "kind": "TEST_STRATEGY",
  "learning_origin": "DEVELOPMENT_ORIGIN",
  "lineage": [{"relation": "REFINE", "related_knowledge_id": "focal_group_canonical_deep_test_policy", "related_origin": "DEVELOPMENT_ORIGIN", "evidence_refs": ["macro_02_1_hermetic_guard"], "notes": ["Risk-based depth now includes pre-collection safety, not only test-body coverage."]}],
  "metrics_refs": ["roadmap_3_x_macro_02_1_learning_reconciliation_metric"],
  "preconditions": ["The repository has tests that import providers, runtimes, SDKs, or credential-aware modules."],
  "privacy_class": "ia_core_internal",
  "procedure": ["Load a root collection guard before test modules.", "Make external probes explicit and opt-in.", "Run protected collection before the broader suite.", "Record any excluded probe with owner, reason, and re-entry condition."],
  "recovery": ["Quarantine the importing probe, preserve maintained unit coverage, and rerun collection under the default fail-closed boundary."],
  "scope": "IA_CORE_BUILD",
  "source_checkpoints": ["ROADMAP_3_X_MACRO_02", "ROADMAP_3_X_MACRO_02_1"],
  "source_commits": ["ad7a3dcac1959aba086c1098b126e8c97b9e32b8", "e2eedb8", "d95ffba"],
  "status": "CANDIDATE",
  "stop_conditions": ["Do not claim collection safety from a green test body if import can execute first.", "Do not authorize external collection by test name alone."],
  "summary": "Test collection and import must not initiate providers, network, credentials, runtime, or persistence before explicit opt-in.",
  "superseded_by": [],
  "supersedes": [],
  "tags": ["tests", "hermetic", "collection", "network", "import"],
  "title": "Test collection must be side-effect free",
  "updated_at": "2026-09-11T00:00:00+00:00",
  "validation": ["Default root collection passes without importing legacy runtime probes."]
}
