{"schema_version":"gokv.knowledge_item.v1","applicability":{"mission_types":["ui_ux","architecture","contract_audit"],"scopes":["IA_CORE_BUILD","GLOBAL"]},"confidence":{"level":"HIGH","rationale":"La clasificaciÃ³n 1.198/1.199 preservÃ³ backend contract authoritative, deny-by-default y no inferencia desde UI."},"decision_rules":["Ante conflicto, el contrato y la evidencia tienen prioridad sobre una inferencia visual."],"evidence_refs":[{"evidence_id":"contract_over_ui_1199","kind":"document","ref":"docs/UI_UX_PANEL_MAESTRO_MICROCOPY_DIRECTION_PACKAGES_1_199.md","claim":"Action/permission no puede inferirse desde copy o affordance."}],"failure_modes":["Convertir un label o allowed_actions en permiso operativo."],"knowledge_id":"contract_over_ui_inference","knowledge_version":"0.1.0","kind":"PRINCIPLE","metrics_refs":[],"preconditions":["Contrato y superficie identificados."],"privacy_class":"ia_core_internal","procedure":["Consultar contrato, clasificar boundary y preservar UI read-only."],"recovery":["Detenerse y solicitar cambio contractual si el contrato no alcanza."],"scope":"IA_CORE_BUILD","source_checkpoints":["UI_UX_1_198","UI_UX_1_199"],"source_commits":["0784c38","609d19f"],"status":"VALIDATED","stop_conditions":["No inferir permiso, ejecuciÃ³n o estado activo desde presentaciÃ³n."],"summary":"La UI no puede ampliar autoridad ni contrato mediante interpretaciÃ³n.","superseded_by":[],"supersedes":[],"tags":["contract","security","ui_boundary"],"title":"Contract over UI inference","updated_at":"2026-09-08T00:00:00+00:00","validation":["Guards negativos y diff productivo vacÃ­o."],"created_at":"2026-09-08T00:00:00+00:00"}
