{
  "schema_version": "gokv.knowledge_item.v1",
  "applicability": {"mission_types": ["all_development", "test_hardening"], "scopes": ["IA_CORE_BUILD", "GLOBAL"]},
  "confidence": {"level": "LOW", "rationale": "Observed in Macro-Mission 02.1: historical tests wrote agent memory and shared learning files and restored them only afterward."},
  "created_at": "2026-09-11T00:00:00+00:00",
  "decision_rules": ["A test write is valid only when its destination is a temporary root or an explicitly injected sandbox."],
  "evidence_refs": [
    {"evidence_id": "macro_02_1_phantom_side_effects", "kind": "document", "ref": "docs/ROADMAP_3_X_MACRO_02_1_PHANTOM_SIDE_EFFECT_CONTAINMENT.md", "claim": "The four historical writes and their call chains are identified and redirected."},
    {"evidence_id": "macro_02_1_phantom_guard", "kind": "test", "ref": "tests/test_roadmap_3_x_macro_02_1_phantom_side_effects.py", "claim": "Protected writes fail immediately and allowed writes remain below tmp_path."}
  ],
  "failure_modes": ["A test changes a tracked memory, evidence, configuration, log, or product state file and relies on restoration after the run."],
  "knowledge_id": "test_writes_require_temporary_boundary",
  "knowledge_version": "0.1.0",
  "kind": "TEST_STRATEGY",
  "learning_origin": "DEVELOPMENT_ORIGIN",
  "lineage": [{"relation": "REFINE", "related_knowledge_id": "local_rollback", "related_origin": "DEVELOPMENT_ORIGIN", "evidence_refs": ["macro_02_1_phantom_side_effects"], "notes": ["Rollback remains recovery; it no longer substitutes for pre-write containment."]}],
  "metrics_refs": ["roadmap_3_x_macro_02_1_learning_reconciliation_metric"],
  "preconditions": ["Tests invoke persistence helpers or code paths with default repository roots."],
  "privacy_class": "ia_core_internal",
  "procedure": ["Inject temporary persistence roots before test execution.", "Block protected writes at the filesystem boundary.", "Capture tracked-state status before and after the session.", "Report path and caller when containment fails."],
  "recovery": ["Stop the suite, isolate the writer, and rerun from the last clean checkpoint without destructive repository rollback."],
  "scope": "IA_CORE_BUILD",
  "source_checkpoints": ["ROADMAP_3_X_MACRO_02", "ROADMAP_3_X_MACRO_02_1"],
  "source_commits": ["ad7a3dcac1959aba086c1098b126e8c97b9e32b8", "effdcd2", "d95ffba"],
  "status": "CANDIDATE",
  "stop_conditions": ["Do not call a restored repository clean evidence of no side effect.", "Do not allow a test to write real product persistence as a fixture shortcut."],
  "summary": "Test persistence must be bounded before the write; post-run restoration is recovery evidence, not hermeticity evidence.",
  "superseded_by": [],
  "supersedes": [],
  "tags": ["tests", "hermetic", "writes", "temporary", "persistence"],
  "title": "Test writes require a temporary boundary",
  "updated_at": "2026-09-11T00:00:00+00:00",
  "validation": ["Debate and scoring flows pass with temporary stores and the tracked tree remains unchanged."]
}
