{
  "applicability": {
    "mission_types": [
      "all_development"
    ],
    "scopes": [
      "IA_CORE_BUILD",
      "GLOBAL"
    ]
  },
  "confidence": {
    "level": "HIGH",
    "rationale": "1.197 y 1.199 eligen prefijo de commit segÃºn diff real y no segÃºn nombre planificado."
  },
  "created_at": "2026-09-08T00:00:00+00:00",
  "decision_rules": [
    "El diff real domina el tipo de commit."
  ],
  "evidence_refs": [
    {
      "claim": "La semÃ¡ntica de commits queda gobernada por realidad del diff.",
      "evidence_id": "real_diff_commit_1197",
      "kind": "document",
      "ref": "docs/UI_UX_PANEL_MAESTRO_POST_LARGE_SCALE_BLOCK_REVIEW_1_197.md"
    }
  ],
  "failure_modes": [
    "Usar feat/fix/refactor por comodidad narrativa."
  ],
  "kind": "COMMIT_STRATEGY",
  "knowledge_id": "real_diff_over_planned_commit_name",
  "knowledge_version": "0.1.0",
  "learning_origin": "DEVELOPMENT_ORIGIN",
  "lineage": [],
  "metrics_refs": [],
  "preconditions": [
    "Diff real disponible antes de commit."
  ],
  "privacy_class": "ia_core_internal",
  "procedure": [
    "Inspeccionar paths, naturaleza del cambio y tests; elegir prefijo congruente."
  ],
  "recovery": [
    "Detener commit si el mensaje no describe el diff."
  ],
  "schema_version": "gokv.knowledge_item.v1",
  "scope": "IA_CORE_BUILD",
  "source_checkpoints": [
    "UI_UX_1_197",
    "UI_UX_1_199"
  ],
  "source_commits": [
    "6b9c806",
    "7cb7134"
  ],
  "status": "PROMOTED",
  "stop_conditions": [
    "No usar feat(ui) sin producto ni fix(ui) sin defecto productivo."
  ],
  "summary": "La realidad del diff prevalece sobre el nombre anticipado de la estaciÃ³n.",
  "superseded_by": [],
  "supersedes": [],
  "tags": [
    "git",
    "semantics"
  ],
  "title": "Real diff over planned commit name",
  "updated_at": "2026-09-08T18:21:03.550773+00:00",
  "validation": [
    "Log de commits 1.197-1.199."
  ]
}
