{"schema_version":"gokv.knowledge_item.v1","applicability":{"mission_types":["audit","ui_ux","architecture"],"scopes":["IA_CORE_BUILD","GLOBAL"]},"confidence":{"level":"HIGH","rationale":"La misiÃ³n 1.199 mantuvo wording y producto intactos cuando la evidencia ya era suficiente."},"decision_rules":["Si una superficie ya cumple el contrato, registrar evidencia y no inventar trabajo."],"evidence_refs":[{"evidence_id":"already_compliant_1199","kind":"checkpoint","ref":"docs/UI_UX_PANEL_MAESTRO_MICROCOPY_DIRECTION_REVIEW_CHECKPOINT_1_199.md","claim":"El checkpoint confirma que no se modificaron superficies productivas."}],"failure_modes":["Crear cambios cosmÃ©ticos para llenar una estaciÃ³n."],"knowledge_id":"already_compliant_do_not_invent_change","knowledge_version":"0.1.0","kind":"PRINCIPLE","metrics_refs":[],"preconditions":["AuditorÃ­a y tests suficientes."],"privacy_class":"ia_core_internal","procedure":["Comparar con contrato, documentar cumplimiento y cerrar sin diff productivo."],"recovery":["Conservar el estado ya correcto y revisar solo evidencia faltante."],"scope":"IA_CORE_BUILD","source_checkpoints":["UI_UX_1_199"],"source_commits":["7cb7134"],"status":"VALIDATED","stop_conditions":["No convertir una deuda no blocker en cambio obligatorio."],"summary":"El cumplimiento demostrado es un resultado vÃ¡lido; no se inventa una correcciÃ³n sin defecto.","superseded_by":[],"supersedes":[],"tags":["audit","scope"],"title":"Already compliant: do not invent change","updated_at":"2026-09-08T00:00:00+00:00","validation":["Diff productivo vacÃ­o y suites verdes."],"created_at":"2026-09-08T00:00:00+00:00"}
