{"schema_version":"gokv.knowledge_item.v1","applicability":{"mission_types":["planning","metrics","architecture"],"scopes":["IA_CORE_BUILD"]},"confidence":{"level":"MEDIUM","rationale":"Los reportes registran estaciones, tests y duraciÃ³n, pero todavÃ­a no existe una mÃ©trica econÃ³mica normalizada por superficie."},"decision_rules":[],"evidence_refs":[{"evidence_id":"cost_surface_1199","kind":"document","ref":"docs/UI_UX_PANEL_MAESTRO_MICROCOPY_POST_DIRECTION_EXECUTION_GRAPH_1_199.md","claim":"El grafo registra ocurrencias y estaciones, no una mÃ©trica econÃ³mica inventada."}],"failure_modes":["Optimizar cantidad de cierres en vez de calidad y evidencia."],"knowledge_id":"cost_per_correctly_closed_surface","knowledge_version":"0.1.0","kind":"COST_RESULT_EVIDENCE","metrics_refs":[],"preconditions":["MÃ©tricas de duraciÃ³n, tests y resultado disponibles."],"privacy_class":"ia_core_internal","procedure":["Medir costo y evidencia por superficie solo cuando los datos estÃ©n disponibles."],"recovery":["Marcar NOT_AVAILABLE si faltan mediciones."],"scope":"IA_CORE_BUILD","source_checkpoints":["UI_UX_1_199"],"source_commits":["7cb7134"],"status":"CANDIDATE","stop_conditions":["No inventar consumo, cuota ni costo."],"summary":"El costo por superficie cerrada es una hipÃ³tesis de mediciÃ³n futura, no una mÃ©trica actual.","superseded_by":[],"supersedes":[],"tags":["metrics","cost"],"title":"Cost per correctly closed surface","updated_at":"2026-09-08T00:00:00+00:00","validation":[],"created_at":"2026-09-08T00:00:00+00:00"}
