{"schema_version":"gokv.knowledge_item.v1","applicability":{"mission_types":["all_development"],"scopes":["IA_CORE_BUILD"]},"confidence":{"level":"HIGH","rationale":"Los manifests de bloques definen rollback localizado y preservaciÃ³n de estaciones anteriores."},"decision_rules":["Rollback solo sobre el artefacto o commit de la estaciÃ³n fallida."],"evidence_refs":[{"evidence_id":"local_rollback_1199","kind":"document","ref":"docs/UI_UX_PANEL_MAESTRO_MICROCOPY_POST_DIRECTION_EXECUTION_GRAPH_1_199.md","claim":"Cada estaciÃ³n declara rollback y frontera."}],"failure_modes":["Usar reset destructivo para recuperar una estaciÃ³n."],"knowledge_id":"local_rollback","knowledge_version":"0.1.0","kind":"RECOVERY_PATTERN","metrics_refs":[],"preconditions":["Commit localizado y baseline conocido."],"privacy_class":"ia_core_internal","procedure":["Identificar estaciÃ³n fallida, revertir su diff y repetir su suite."],"recovery":["Conservar el Ãºltimo gate verde y reportar el bloqueo."],"scope":"IA_CORE_BUILD","source_checkpoints":["UI_UX_1_195","UI_UX_1_199"],"source_commits":["d386c37","6b6b8d0"],"status":"VALIDATED","stop_conditions":["No usar reset --hard ni checkout destructivo."],"summary":"La recuperaciÃ³n debe ser localizada, reversible y conservar la historia previa.","superseded_by":[],"supersedes":[],"tags":["recovery","rollback"],"title":"Local rollback","updated_at":"2026-09-08T00:00:00+00:00","validation":["Rollback declarado por estaciÃ³n y diff protegido vacÃ­o."],"created_at":"2026-09-08T00:00:00+00:00"}
