{
  "applicability": {
    "mission_types": [
      "all_development"
    ],
    "scopes": [
      "IA_CORE_BUILD",
      "GLOBAL"
    ]
  },
  "confidence": {
    "level": "HIGH",
    "rationale": "1.199 ejecutÃ³ focal por estaciÃ³n, grupos, canonical y deep historical cuando hubo adaptaciÃ³n de guards."
  },
  "created_at": "2026-09-08T00:00:00+00:00",
  "decision_rules": [
    "Escalar la suite por riesgo y cobertura, no por cantidad artificial."
  ],
  "evidence_refs": [
    {
      "claim": "El checkpoint distingue grupo canonical y suite histÃ³rica profunda.",
      "evidence_id": "test_policy_1199",
      "kind": "test",
      "ref": "tests/test_ui_ux_panel_maestro_microcopy_direction_review_checkpoint_1_199.py"
    }
  ],
  "failure_modes": [
    "Ejecutar solo tests focales ante cambio transversal."
  ],
  "kind": "TEST_STRATEGY",
  "knowledge_id": "focal_group_canonical_deep_test_policy",
  "knowledge_version": "0.1.0",
  "learning_origin": "DEVELOPMENT_ORIGIN",
  "lineage": [],
  "metrics_refs": [],
  "preconditions": [
    "Definir riesgo y manifest de la estaciÃ³n."
  ],
  "privacy_class": "ia_core_internal",
  "procedure": [
    "Ejecutar focal; ampliar a group; correr canonical; agregar deep historical si se tocan guards."
  ],
  "recovery": [
    "No cerrar mientras una capa requerida falle."
  ],
  "schema_version": "gokv.knowledge_item.v1",
  "scope": "IA_CORE_BUILD",
  "source_checkpoints": [
    "UI_UX_1_198",
    "UI_UX_1_199"
  ],
  "source_commits": [
    "0784c38",
    "dcb2aab"
  ],
  "status": "PROMOTED",
  "stop_conditions": [
    "No confundir cantidad de tests con cobertura."
  ],
  "summary": "La profundidad de tests debe seguir el riesgo y la naturaleza del cambio.",
  "superseded_by": [],
  "supersedes": [],
  "tags": [
    "tests",
    "quality"
  ],
  "title": "Focal group canonical deep test policy",
  "updated_at": "2026-09-08T18:21:03.546763+00:00",
  "validation": [
    "Canonical 155 passed y deep 365 passed en 1.199."
  ]
}
