{
  "schema_version": "gokv.knowledge_item.v1",
  "knowledge_id": "verified_responsibility_per_usage",
  "knowledge_version": "0.1.0",
  "kind": "PATTERN",
  "title": "Verified responsibility per usage",
  "summary": "A descriptive metric for the amount of contract-governed responsibility verified per usage unit; it is not a token, price, currency or performance promise.",
  "status": "CANDIDATE",
  "scope": "IA_CORE_BUILD",
  "applicability": {"mission_types": ["roadmap", "all_development"], "scopes": ["IA_CORE_BUILD", "GLOBAL"]},
  "preconditions": ["Usage data and verified responsibility have independent provenance."],
  "procedure": ["Record verified surfaces and their evidence.", "Record usage only from an approved operator measurement.", "Keep missing or incomparable values null.", "Report the metric descriptively without converting it to money or tokens."],
  "decision_rules": ["A documented surface counts only when its evidence and owner are explicit.", "Do not compare windows separated by a reset as one uninterrupted scale."],
  "stop_conditions": ["Stop if usage, quota or responsibility data is reconstructed from memory or mixed across incompatible windows."],
  "validation": ["Macro 03 execution metric preserves operator-reported provenance and reset quality."],
  "failure_modes": ["Turning an internal descriptive measure into a commercial claim.", "Hiding uncertainty in quota or responsibility counts."],
  "recovery": ["Mark the measurement unavailable or reset-interrupted and preserve the raw operator report."],
  "evidence_refs": [
    {"evidence_id": "macro_02_2_measurement", "kind": "checkpoint", "ref": "docs/ROADMAP_3_X_MACRO_02_2_CHECKPOINT_EVIDENCE.json", "claim": "Macro 02.2 preserves exact suite and publication evidence."},
    {"evidence_id": "macro_03_metric", "kind": "metric", "ref": "knowledge/global_operational/metrics/roadmap_3_x_macro_03_execution_metric.json", "claim": "Operator-reported values remain descriptive and reset-aware."}
  ],
  "source_commits": ["49952068b0ec8e6d03f0de77c213731632c41455"],
  "source_checkpoints": ["ROADMAP_3_X_MACRO_02_2", "ROADMAP_3_X_MACRO_03"],
  "metrics_refs": ["roadmap_3_x_macro_03_execution_metric"],
  "confidence": {"level": "LOW", "rationale": "Candidate metric pattern with no field or commercial validation."},
  "privacy_class": "ia_core_internal",
  "tags": ["metrics", "verified_responsibility", "usage", "non_monetary"],
  "created_at": "2026-09-12T00:00:00+00:00",
  "updated_at": "2026-09-12T00:00:00+00:00",
  "supersedes": [],
  "superseded_by": [],
  "learning_origin": "DEVELOPMENT_ORIGIN",
  "lineage": []
}
