{
  "applicability": {
    "mission_types": [
      "architecture",
      "ui_ux",
      "development_foundation"
    ],
    "scopes": [
      "IA_CORE_BUILD"
    ]
  },
  "confidence": {
    "level": "HIGH",
    "rationale": "El grafo 1.199 identifica vocabulario contractual como frontera que requiere owner y versionado separado."
  },
  "created_at": "2026-09-08T00:00:00+00:00",
  "decision_rules": [
    "Una frontera dura requiere evidencia de cambio contractual, no solo deseo de continuar."
  ],
  "evidence_refs": [
    {
      "claim": "B9 queda fuera de estaciones deterministas y requiere cambio contractual.",
      "evidence_id": "hard_frontier_1199",
      "kind": "checkpoint",
      "ref": "docs/UI_UX_PANEL_MAESTRO_MICROCOPY_POST_DIRECTION_EXECUTION_GRAPH_1_199.md"
    }
  ],
  "failure_modes": [
    "Presentar una frontera contractual como tarea editorial."
  ],
  "kind": "STOP_CONDITION",
  "knowledge_id": "true_hard_frontier",
  "knowledge_version": "0.1.0",
  "learning_origin": "DEVELOPMENT_ORIGIN",
  "lineage": [],
  "metrics_refs": [],
  "preconditions": [
    "Haber separado lo derivable de lo contractual."
  ],
  "privacy_class": "ia_core_internal",
  "procedure": [
    "Nombrar la frontera, owner requerido y prerequisitos antes de continuar."
  ],
  "recovery": [
    "Cerrar el bloque sin cruzar la frontera."
  ],
  "schema_version": "gokv.knowledge_item.v1",
  "scope": "IA_CORE_BUILD",
  "source_checkpoints": [
    "UI_UX_1_199"
  ],
  "source_commits": [
    "6b6b8d0"
  ],
  "status": "PROMOTED",
  "stop_conditions": [
    "Cambio de contrato sin Contract Owner y versiÃ³n explÃ­cita."
  ],
  "summary": "Una frontera dura se reconoce por autoridad contractual, no por dificultad tÃ©cnica.",
  "superseded_by": [],
  "supersedes": [],
  "tags": [
    "frontier",
    "contract"
  ],
  "title": "True hard frontier",
  "updated_at": "2026-09-08T18:21:03.554524+00:00",
  "validation": [
    "Grafo post-DirecciÃ³n y Decision Sheet."
  ]
}
