{"schema_version":"gokv.knowledge_item.v1","applicability":{"mission_types":["all_development"],"scopes":["IA_CORE_BUILD","GLOBAL"]},"confidence":{"level":"HIGH","rationale":"La polÃ­tica y la ejecuciÃ³n 1.199 rechazaron commit globo y squash."},"decision_rules":["No usar un commit Ãºnico para estaciones independientes."],"evidence_refs":[{"evidence_id":"no_giant_commit_1199","kind":"document","ref":"docs/UI_UX_PANEL_MAESTRO_MICROCOPY_POST_DIRECTION_EXECUTION_GRAPH_1_199.md","claim":"El grafo exige estaciones con gates y rollback propios."}],"failure_modes":["Perder causalidad entre artefacto, test y gate."],"knowledge_id":"no_giant_commit","knowledge_version":"0.1.0","kind":"COMMIT_STRATEGY","metrics_refs":[],"preconditions":["Existencia de mÃ¡s de una estaciÃ³n."],"privacy_class":"ia_core_internal","procedure":["Usar un commit por estaciÃ³n material con prefijo congruente."],"recovery":["Aislar el commit que introdujo el defecto."],"scope":"IA_CORE_BUILD","source_checkpoints":["UI_UX_1_199"],"source_commits":["6b6b8d0","7cb7134"],"status":"VALIDATED","stop_conditions":["Detener si solo puede cerrarse con un commit globo."],"summary":"La trazabilidad de estaciones requiere evitar commits gigantes y squash prematuro.","superseded_by":[],"supersedes":[],"tags":["git","rollback"],"title":"No giant commit","updated_at":"2026-09-08T00:00:00+00:00","validation":["Verificar log, paths y diff por commit."],"created_at":"2026-09-08T00:00:00+00:00"}
