{
  "schema_version": "gokv.knowledge_item.v1",
  "applicability": {"mission_types": ["all_development"], "scopes": ["IA_CORE_BUILD", "GLOBAL"]},
  "confidence": {"level": "LOW", "rationale": "Observed once in Macro-Mission 01; no operational write was performed."},
  "created_at": "2026-09-11T00:00:00+00:00",
  "decision_rules": ["A legacy write is not acceptable as a safe surface until owner, storage, containment, rollback, and failure behavior are proven."],
  "evidence_refs": [
    {"evidence_id": "macro_01_route_reconnaissance", "kind": "document", "ref": "docs/ROADMAP_3_X_MACRO_01_ROUTE_RECONNAISSANCE.md", "claim": "Domain materialization was safe only inside its documented boundary."},
    {"evidence_id": "sandbox_rollback_contract", "kind": "document", "ref": "docs/SANDBOX_INTEGRAL_ROLLBACK_6_1.md", "claim": "Sandbox containment and rollback are separate proof obligations."}
  ],
  "failure_modes": ["Treating an existing writer as an authorized product persistence path."],
  "knowledge_id": "legacy_write_needs_boundary_proof",
  "knowledge_version": "0.1.0",
  "kind": "ARCHITECTURAL_LEARNING",
  "learning_origin": "DEVELOPMENT_ORIGIN",
  "lineage": [],
  "metrics_refs": ["roadmap_3_x_macro_01_learning_adjudication_metric"],
  "preconditions": ["A source write or materializer is visible in the repository."],
  "privacy_class": "ia_core_internal",
  "procedure": ["Identify the write owner.", "Classify its storage root and sensitivity.", "Verify path containment and rollback contracts.", "Keep product execution disabled until all boundaries are proven."],
  "recovery": ["Use an isolated fixture or documentation-only evidence and leave the operational path untouched."],
  "scope": "IA_CORE_BUILD",
  "source_checkpoints": ["ROADMAP_3_X_MACRO_01"],
  "source_commits": ["be5986e0f8fd49a61694d2d8752bae20f0f52c52", "678910e119304cdc9cbbcd71ca0e72560c0f538d", "5fb046934ab764020b23dcf9a883b0e3a6896502", "fbbc5372865467c4c5de3c09e580644971e2d163"],
  "status": "CANDIDATE",
  "stop_conditions": ["No product store, external data, or operational traffic may be touched."],
  "summary": "A legacy write needs explicit ownership, containment, rollback, and failure-boundary proof.",
  "superseded_by": [],
  "supersedes": [],
  "tags": ["persistence", "sandbox", "rollback"],
  "title": "Legacy write needs boundary proof",
  "updated_at": "2026-09-11T00:00:00+00:00",
  "validation": ["Macro 01 route reconnaissance and sandbox rollback contract tests."]
}
